input,response
"Tomorrow is an extremely important day for us, we must get some sleep.","Tomorrow holds immense significance for us, thus, we must ensure we get some rest."
"This whole gathering was organized just for you and your team.","This entire gathering has been orchestrated exclusively for you and your team."
"There is much more work here than we expected, it will take us a little more time.","The workload here exceeds our initial expectations, and it will require a bit more time to complete."
"This may not be enough, but I cannot offer more than that.","I acknowledge that this might not be sufficient, but I cannot offer more than what is presented."
"Forget everything you heard from him, now you will hear the real story.","Disregard everything you heard from him, now you will hear the genuine account."
"Time passes very slowly, every minute lasts like an hour.","Time seems to pass agonizingly slowly, each minute feels as if it lasts an hour."
"We have to go through this one more time, it seems to me that not everyone understood the meaning of this.","We need to go through this once more, it appears that not everyone grasped the significance of this matter."
"This is the last thing you will hear from me, so listen carefully.","Consider this as the final message you will receive from me, thus pay close attention."
"We're so close to the end, hang on a little longer.","We are on the brink of reaching the end, hold on a little while longer."
"I was told that I don't need to have prior knowledge, but nothing is clear to me.","Although I was assured that prior knowledge wasn't necessary, everything remains unclear to me."
"Everything looks so strange, as if I'm in a dream, and maybe I am.","Everything appears so peculiar, almost as if I am in a dream, and perhaps I am."
"I always wanted to know how to draw, but I never bothered to learn.","I have always harbored a desire to learn how to draw, but I never took the initiative to acquire the skill."
"Just a few more things and we're done.","Only a few more things to attend to, and we will be finished."
"Do you remember your first seminar?","I wonder if you have any recollection of your first seminar?"
"Every time I return to this place, I see something new, something exciting.","Each time I revisit this place, I am enthralled by the discovery of something new and captivating."
"How is it possible that the show is still going on?","I am perplexed by the fact that the show is still ongoing."
"Okay, now we're really done, I'd like to take this opportunity to thank everyone who participated.","Alright, now we have truly reached the end. I'd like to take this moment to express my gratitude to everyone who participated."
