input,response
"I don't agree with you","Regrettably, I must dissent on this matter, as our perspectives diverge gracefully. While I value your insights, my reflections lead me to a different conclusion."
"I am looking forward to it","Enthusiastically awaiting the moment with great anticipation."
"Today is a nice day, how do you plan to spend it?","Today graces us with its splendor. How shall you embrace its blessings?"
"I didn't fully understand you, can you explain it a little better?","Forgive my misunderstanding. Could you kindly elucidate further for me to grasp the idea more effectively?"
"Could you please help me with this project?","With utmost gratitude, may I seek your invaluable assistance in this endeavor?"
"I couldn't solve the problem, I'm very sorry, I hope you understand.","I humbly admit my inability to resolve the issue at hand. My sincerest apologies, and I sincerely hope for your understanding."
"I would like to get a promotion, I think I deserve it.","With confidence in my contributions and accomplishments, I respectfully express my aspiration for a promotion, as I believe my efforts warrant such recognition."
"The clients could not have guessed that such a thing would happen.","The clients were caught completely unaware by the unexpected turn of events."
"If I don't like something, I'll stay away from it.","When faced with something disagreeable, I opt to maintain my distance from it."
"Let me help you with your baggage.","Allow me the pleasure of assisting you with your belongings."
"Everyone was busy, so I went to the movie alone.","Amidst a bustling crowd, finding everyone occupied, I ventured to the cinema solo."
"Please wait outside of the house.","I kindly request you to wait outside the house."
"I covered my friend in baby oil.","I generously applied baby oil to my friend's body."
"Check back tomorrow, I will see if the book has arrived.","Do check back tomorrow, I shall ascertain whether the book has arrived."
"Let's all just take a moment to breathe, please!","Let us collectively pause and take a moment to breathe, if you may."
"It is none of your business.","The matter does not concern you."
"You don't have to carry much cash.","Carrying a substantial amount of cash is unnecessary."
"I seriously doubt she actually believes you.","I hold serious doubts regarding her genuine belief in your words."
"Can I help you?","Might I be of assistance to you?"
"How did you get so much money?","What path led you to acquire such abundant wealth?"
"He can't take the joke.","He appears to lack the ability to appreciate humor."
"Who do they believe you are?","Whom do they perceive you to be?"
"I could be proposing next week.","Next week, there is a possibility that I might make a proposal."
"Good morning!","A delightful morning to you!"
"Don't worry, be happy!","Let go of your worries and embrace happiness!"
"What's your favorite color?","May I inquire about your most cherished color?"
"Don't open the door!","Kindly refrain from opening the door."
"Please just give me one more!","With utmost courtesy, may I request one more?"
"Let's go to the mall today!","Today, let us venture to the mall for an enjoyable outing!"
"How beautiful she is!","What a stunning beauty she possesses!"
"You are making a big mistake.","It appears that you are on the verge of making a substantial error."
"Cry all you want!","Feel free to shed as many tears as your heart desires."
"There was a big earthquake last night.","Last night, a significant earthquake shook the area."
"We went to Paris this afternoon.","This very afternoon, we journeyed to the beautiful city of Paris."
"I added his name to the book.","I gracefully inscribed his name into the book."
"That makes a big difference, doesn't it?","Indeed, it makes a significant difference, wouldn't you agree?"
"I'd like us to repair our differences.","I earnestly wish for us to reconcile and mend our differences."
"What do you want me to say?","What words do you desire me to express?"
"Turning the page is important to progress.","To advance, it is crucial to turn the page."
"Are you seriously going to let him talk about me that way?","Are you genuinely going to allow him to speak about me in such a manner?"
"Why not go back to them and tell them you changed your mind?","Why not consider revisiting them and informing them of your change of heart?"
"She didn't have anything to do, so she wandered around the city.","With no particular task at hand, she aimlessly roamed around the city."
"Did I tell you I saw a big rat in the kitchen?","Have I mentioned that I spotted a sizable rat in the kitchen?"
"I'll try doing that this weekend.","I intend to attempt that task during the upcoming weekend."
"As our own moon does to Earth, they would always present the same side to their sun.","Like Earth's moon to our planet, they would perpetually show the same face to their sun."
"Drawing a protection plan like this has never been tried before, and it presents several novel problems.","Crafting a safeguarding strategy of this nature has not been previously attempted, and it introduces various innovative challenges."
"I would have gotten the promotion, but my attendance wasn't good enough.","Had my attendance been better, I would have undoubtedly secured the promotion."
"The team members were hard to tell apart since they all wore their hair in a ponytail.","The team members proved challenging to distinguish as they all wore their hair in a ponytail."
"In the end, he realized he could see sound and hear words.","Ultimately, he came to the realization that he could perceive sound and hear words."
"I just wanted to tell you I could see the love you have for your child by the way you look at her.","I simply wanted to convey that I can discern the love you hold for your child through the affectionate gaze you bestow upon her."
"The rain pelted the windshield as the darkness engulfed us.","Amidst the engulfing darkness, the rain fiercely battered the windshield, creating an atmosphere of intensity around us."
"The secret ingredient to his wonderful life was crime.","The clandestine element behind his remarkable life was, unfortunately, tied to criminal activities."
"All you need to do is pick up the pen and begin.","Merely grasp the pen and initiate, that's all it takes."
"Separation anxiety is what happens when you can't find your phone.","Separation anxiety ensues when you are unable to locate your phone."
"The virus had powers none of us knew existed.","The virus possessed abilities that none of us were aware of before."
"He who knows that enough is enough will always have enough.","One who understands that sufficiency is enough will forever be content."
"If you spend your whole life waiting for the storm, you'll never enjoy the sunshine.","Should you spend your entire life anticipating the storm, you shall never relish the warmth of sunshine."
"Don't cry because it's over. Smile because it happened.","Do not weep over its conclusion. Instead, smile in appreciation for the experience it bestowed upon you."
"I hope this email finds you well","With warm regards, I hope this email discovers you in good health and spirits."
"I am writing to extend an invitation to you for our upcoming company networking event.","Allow me to compose this message to cordially invite you to our upcoming company networking event."
"This event provides a great opportunity for professionals like yourself to connect, exchange ideas, and build valuable relationships within our industry.","This occasion offers an excellent platform for professionals, such as yourself, to forge connections, share insights, and foster meaningful relationships within our industry."
"We have lined up some prominent speakers who will share their insights on the latest trends and advancements.","We have arranged a lineup of distinguished speakers who will graciously impart their wisdom on the latest trends and cutting-edge developments."
"We believe your presence at this event will greatly contribute to the success of the evening.","We firmly believe that your participation in this event will play a pivotal role in ensuring the resounding success of the evening."
"We look forward to welcoming you and fostering meaningful connections at our networking event.","We eagerly anticipate your presence and the opportunity to cultivate significant connections during our networking event."
"Tom got a small piece of pie.","Tom was treated to a delightful slice of a small pie."
"Chocolate covered crickets were his favorite snack.","His preferred snack was chocolate-covered crickets."
"She wondered what his eyes were saying beneath his mirrored sunglasses.","Curiosity consumed her as she pondered the hidden messages behind his mirrored sunglasses."
"I am informing you that I am having problems with the internet connection.","I would like to apprise you that I am currently encountering issues with the internet connection."
"What steps should be taken to solve the problem?","To address the issue, what course of action ought to be pursued?"
"I can make a window to discuss your four-dimensional modular projections.","I am adept at creating an opportunity to explore your four-dimensional modular projections in a meaningful discussion."
"We now offer diplomas in global management matrix approaches.","Pleased to announce that we now provide diplomas in global management matrix approaches."
"Our upgraded model now offers millennial management hardware.","Delighted to share that our enhanced model now incorporates millennial management hardware."
"We're going forward with our plans to implement parallel management flexibility.","I'm glad to inform you that we are proceeding with our plans to implement parallel management flexibility."
"We need a more contemporary reimagining of our compatible organizational processing.","We are in need of a more modern reinterpretation of our compatible organizational processing."
"You really can't fail with optional third-generation alignment.","With optional third-generation alignment, success is virtually assured."
"It's time to revamp and reboot our holistic reciprocal hardware.","Indeed, the moment has arrived to revitalize and reboot our all-encompassing reciprocal hardware."
"I can make a window to discuss your homogenised policy paradigm shifts.","I can create an opportunity to delve into a discussion regarding your homogenized policy paradigm shifts."
"This is no time to bite the bullet with our facilitating incremental projections.","This is not the moment to rush into action with our facilitating incremental projections."
"We need to cascade memos about our interactive reciprocal projections.","We should disseminate memos regarding our interactive reciprocal projections."
"The consultants recommend remote strategic time-phases.","The consultants advise implementing remote strategic time-phases."
"I remind you that I am not able to answer you.","Allow me to reiterate that I am unable to respond to your inquiries."
"I'm very busy right now, I'll get back to you later.","At present, I am occupied with various tasks. I shall reach out to you later."
"Seek help from a colleague on the third floor.","I suggest seeking assistance from a colleague located on the third floor."
"He talked to him today, I guess he got all the necessary information.","He engaged in conversation with him today, and it appears he obtained all the requisite information."
"We need a few more days to know what needs to be done.","We require a few additional days to ascertain what actions need to be taken."
"It never occurred to me that such an outcome could happen.","The possibility of such an outcome had never crossed my mind."
"In the end, everything turned out well.","Ultimately, everything concluded on a positive note."
"I wasn't sure if we would be able to finish the project on time.","Initially, I harbored doubts about our ability to complete the project within the designated timeframe."
"I wish I could go back in time and do things differently.","How I yearn to travel back in time and make different choices."
"Do you think he did well?","In your opinion, do you believe he performed admirably?"
"Can I ask you something?","May I have the privilege of posing a question to you?"
"Did we make a good choice and will this all end well?","Did our decision prove wise, and can we anticipate a favorable resolution to all this?"
"Why didn't we think of this before?","Why did this idea not occur to us earlier?"
"I think she is angry because I got in before her.","I believe her anger stems from the fact that I entered before her."
"Thank you for everything, how can I repay you?","Gratitude for all you've done. How may I reciprocate your kindness?"
"The most important thing is that everyone in the team is united.","Above all else, the paramount aspect is the unity of everyone within the team."
"I haven't spoken to him since he quit.","Since he resigned, I haven't had any communication with him."
"Do you think she is the right choice for this position?","In your opinion, do you believe she is the suitable candidate for this position?"
"You are very good at what you do, how long have you been doing this?","Your exceptional skills are evident. I'm curious to know how long you have been honing them?"
"I believe that we have stayed too long on this task, it is time to move on.","I hold the belief that we have devoted excessive time to this task, and now, it is prudent to progress to the next phase."
"I wonder how many people in this building have access to that information.","I am curious about the number of individuals within this building who possess access to that particular information."
"I know it's a stupid question, but where do you see yourself in five years?","While I acknowledge it might seem like an unimportant inquiry, I am genuinely interested in knowing where you envision yourself five years from now."
"I tried everything in my power but in the end I gave up.","I exerted all efforts within my capabilities, but eventually, I had to surrender and let go."
"Correct me if I'm wrong, but I don't think anyone here knows what they're doing anymore.","Please feel free to correct me if I am mistaken, but I get the sense that nobody here is certain about what they are doing anymore."
"We have reached the point of no return, now we must do our best.","We have arrived at the point of no return, and from here on, we must give our utmost effort."
"I'm glad we managed to come to an agreement, I was worried all along that we wouldn't agree.","I am relieved that we were able to reach an agreement. Throughout the process, I harbored concerns about our ability to find common ground."
"I'm sorry I wasn't at the meeting, did I miss something important?","I apologize for my absence at the meeting. Did I miss anything of significance?"
"I was told not to talk about those things.","I was advised against discussing those matters."
"I've always wondered how they do so well in an unfamiliar environment.","I've always been curious about their remarkable success in an unfamiliar setting."
"Well done, you did a very good job and you should be proud of yourself!","Congratulations! You have done exceptionally well, and you should take pride in your achievements!"
"The things he said about me really bother me!","The remarks he made about me truly unsettle me!"
"First of all, I would like to introduce myself and say a few words about my experience.","To begin, allow me to introduce myself and share a few words about my background and experience."
"I haven't felt this excited in a long time, I can't wait for the presentation!","It's been quite some time since I've felt this exhilarated. I am eagerly anticipating the presentation!"
"This book changed my view of the world, you must read it!","This book has completely transformed my perspective on the world. I highly recommend that you read it too!"
"Sometimes I wonder if I am on the right path and if my whole life has meaning.","At times, I find myself pondering whether I am on the correct path and if my entire life holds purpose and significance."
"This is the first time I have encountered this kind of challenge.","This is the inaugural occasion that I have encountered such a unique challenge."
"Do you have any tips for me when it comes to productivity?","Could you kindly share any valuable tips to enhance productivity in my daily pursuits?"
"Sometimes I feel like I can't achieve everything I want.","Occasionally, I experience a sense of limitation in achieving all that I desire."
"I would not like to find myself in such a situation because I would not know how to react.","I would prefer not to encounter such a circumstance as I am uncertain about how I would respond."
"Today I have to meet the boss, do you want to come with me?","Today, I have a meeting with the boss. Would you like to join me?"
"I noticed that he doesn't like to be around me, maybe he doesn't like my company.","I observed that he seems uncomfortable in my presence. Perhaps he does not enjoy my company."
"I have too much work this week, I just want to rest.","This week's workload is quite overwhelming, and I yearn for some rest and relaxation."
"I learned a lot from her, too bad she moved far away from here.","I gained valuable insights from her, but it's unfortunate that she relocated far away from here."
"You disappointed me, I expected more from you, especially under these conditions.","Your actions have left me feeling disappointed, I had higher expectations, especially given the prevailing circumstances."
"A leisurely walk in the woods always clears my mind.","A leisurely stroll in the woods never fails to refresh my mind."
"If you ever feel the need to talk to someone, feel free to contact me.","Should you ever find the desire to confide in someone, don't hesitate to reach out to me."
"I will soon move on to another project, I will miss this team.","I will soon transition to another project, and I will undoubtedly miss being part of this remarkable team."
"We still haven't had the chance to meet in person.","Regrettably, we have not yet had the opportunity to meet face-to-face."
"Have you known each other for a long time or have you met relatively recently?","Have you two been acquainted for an extended period, or did you meet relatively recently?"
"This change of environment has a positive effect on me, I finally feel alive.","This shift in environment has had a positive impact on me, I finally feel invigorated and alive."
"I talked to everyone in the group and I concluded that everyone was equally excited about going on the trip.","After conversing with each member of the group, I arrived at the conclusion that everyone shares an equal level of excitement about the upcoming trip."
"This feeling cannot be described in words.","Words fail to describe the intensity of this emotion."
"I can't believe it, I forgot what I wanted to say.","I'm astonished, I seem to have forgotten what I intended to say."
"I'm not sure if this is enough material, we may have to buy more.","I'm uncertain if this quantity of material will suffice, we might need to consider purchasing more."
"I'm still at home, I'll be back soon.","As of now, I'm still at home, but I'll return shortly."
"Have you ever wondered if there is life after death?","Have you ever pondered the existence of life after death?"
"This event is unprecedented, no one could have hoped for this.","This event is truly unparalleled, no one could have anticipated such an outcome."
"This is outrageous, we can't stop here!","This is utterly unacceptable we cannot halt our efforts at this point!"
"I remember when they promised us better conditions, do you remember too?","I recall when they made promises of improved conditions, do you also have recollections of it?"
"I've always suspected this, but I still hoped it wouldn't come to that.","Though I've harbored suspicions, I held onto hope that it wouldn't come to this."
"All our fears have come true, how is that possible?","It's disheartening that all our fears have materialized. How did this become a reality?"
"I have worked on such systems for years and know them very well.","Having devoted years to working with such systems, I possess a comprehensive understanding of them."
"Could you explain to me again how to use this thing?","Would you mind providing me with a further explanation on how to use this particular item?"
"I made a mistake, how can I fix it?","I've made an error. How can I rectify it?"
"Is there any explanation for this bad weather?","Is there any rationale behind this inclement weather?"
"How dare you talk to me like that?","I must express my surprise at the manner in which you addressed me."
"Now the whole room is contaminated, why did you let him do that?","The entire room is now contaminated. Why did you permit him to do that?"
"This has gone too far, we have to make changes if we want to continue working.","This situation has reached an excessive extent, and we must implement changes if we wish to continue our work."
"Nobody knows how this device works, not even the person who made it.","No one comprehends how this device operates, not even its creator."
"I tried to go through the hole, but it's too small.","I attempted to pass through the hole, but it's too narrow."
"I ate a lot of food for lunch, I'm not feeling well.","Having consumed a substantial amount of food for lunch, I am now feeling unwell."
"That must be the most unpleasant story I have ever heard.","Without a doubt, that must be the most unpleasant story I have ever come across."
"They didn't think of us when they made that decision, they only think of themselves.","It's evident that they did not consider us when making that decision, their focus was solely on themselves."
"It's not reality, it's all made up.","This isn't reality, it's all fabricated."
"I can't wait for office hours to end, I have various plans for tonight.","I'm eagerly awaiting the end of office hours as I have various plans for tonight."
"They threatened to fire me, but that wasn't enough to stop me.","Despite their threat to fire me, it wasn't sufficient to deter my determination."
"Sometimes we have to fight for a higher goal.","On occasion, we must contend for a loftier objective."
"I don't know what to say anymore, I feel like I've already said everything.","I'm at a loss for words, it seems I've already expressed everything I could."
"I would not like to repeat myself.","I prefer not to reiterate what has already been said."
"Every day I see new faces on the street, who are all these people?","Each day, I encounter new faces on the street, and I can't help but wonder, who are all these people?"
"The lighting in this room is very bad, my eyes hurt.","The lighting in this room is extremely inadequate, causing discomfort and strain to my eyes."
"I respect her even after everything she told me.","Despite everything she revealed, I continue to hold a deep respect for her."
"I don't deal with such things anymore, I got bored.","I no longer engage with such matters, they have grown monotonous to me."
"It is very important to do what makes you happy.","Indeed, it is of utmost importance to pursue actions that bring you genuine happiness."
"Days pass, but nothing changes.","As the days go by, everything remains unaltered."
"Someone once told me that one day everything will be fine.","Once, someone imparted to me the belief that someday everything will be fine."
"As someone who has been in this business for quite a long time, I can say that this does not make sense.","As an individual who has been in this business for an extended period, I can confidently assert that this does not seem logical."
"You have to respect others if you want others to respect you.","To earn the respect of others, it is essential to demonstrate respect towards them."
"I wish I could agree with you, but unfortunately I can't.","I wish I could concur with you, but regrettably, I cannot."
"I was never good at writing letters.","Writing letters has never been my strong suit."
"His departure has affected us all, but we must remain strong.","His departure has had a profound impact on all of us, but we must persevere and stay resilient."
"The only option is to agree to disagree.","It seems the best course of action is to acknowledge our differing opinions and agree to disagree."
"Too much work and effort left me empty inside.","The excessive workload and effort have left me feeling empty inside."
"That type of work has always been my biggest obsession.","Engaging in that type of work has always been my foremost obsession."
"I never thought that something like this would be possible.","I never envisioned that something like this would be conceivable."
"Look how far that kind of thinking has gotten us.","Observe how far that manner of thinking has led us."
"Let's go through the requirements together.","Shall we review the requirements together?"
"Don't pay attention to him, he doesn't know what he's talking about.","Disregard his remarks, he lacks comprehension of the subject matter."
"That's it, we made a deal, please don't forget about this.","That concludes it, we have reached an agreement. Please ensure not to overlook this commitment."
"This conversation is extremely confidential, I hope you understand that.","I must emphasize the utmost confidentiality of this conversation, and I trust you comprehend its significance."
"He was forbidden to talk about it, but that didn't stop him from spreading the information.","Despite being forbidden to discuss it, he proceeded to disseminate the information regardless."
"I hope this is enough, it's all I could find.","I hope this suffices, it's all I was able to locate."
"I thought there was some limitation here, but it seems I was wrong.","I initially believed there was a constraint in this regard, but it appears I was mistaken."
